"Moon Hartnell opened her eyes and reached for her phone. The screen said <-<-<-<6.51 a.m.>->->-> on 14 February, Valentine's Day. Most mornings, she would stay in bed until her alarm went off. Usually for a while after that, too - as long as it took Mum to bang on her door."
"Sasha and Charlie caught the <-<-<-<6:52>->->-> from Victoria to Merrifield the following morning, and arrived at the local Labour Party headquarters just before 8 a.m."
"Having lied to Mum, I realised that my only option was to take the <-<-<-<06.52>->->-> to London as if I hadn't been dismissed at all."
"So that was the key to asking my questions, to wait exactly 77 minutes before <-<-<-<seven minutes to seven>->->-> and I would then get my answer."
"And to see if maybe - just maybe - she might have answered him, even though it was now <-<-<-<six minutes before seven in the morning>->->->."
"It was <-<-<-<five minutes to seven>->->-> the next morning. Sergeant Masterson and Detective Constable Greeson were in the kitchen at Nightingale House with Miss Collins and Mr. Muncie. It seemed like the middle of the night to Masterson, dark and cold."
At <-<-<-<6:55 am>->->-> Lisa parked and took the lift from the frozen underground car park up to level 1 of Green Oaks Shopping Centre.
"Well, I've only to say I'm sorry to cause all this fuss, y'know - and, well, yes, I would like a smoke, replied the condemned man, and added hastily: ""Don't think I want to delay things for a moment though - but if there is time. . .""<br>""It is <-<-<-<four minutes to seven>->->->,"" said Major Ranald, ""and tobacco and matches are not supposed to be found in a government jail."""
"Down ramp, park, show FBI pass to garage guard, run for elevator: <-<-<-<6:57>->->->;"
That meant that Helen must run and get the table set as quickly as possible as it was <-<-<-<three minutes to seven>->->->.
"They waited. At exactly <-<-<-<two minutes to seven>->->->, a white car came into view and pulled into the employee's parking lot behind the building."
"<-<-<-<6:58 A.M.>->->-><br>Hugo Voorst was lying propped against a rock, his shoulder bandaged with white strips of gauze from the first-aid kit. Now that the flow of blood had been staunched, Marcel was injecting him with a shot of morphine to quell the looming pain."
She barely glances up; knock on door of Director’s office; no reply; go in as instructed. No Director: <-<-<-<6:59>->->->; sink into easy chair. Director going to be late; smile of satisfaction.
"At <-<-<-<one minute to seven>->->->, Lieutenant Colonel Robertson marched up on to the stage, and everyone else in the room quickly fell silent and sprang to attention. He stopped in the center of the stage and waved the men down."
"It was <-<-<-<6.59 a.m.>->->-> on Maundy Thursday as Blomkvist and Berger let themselves into the ""Millennium"" offices."
Moist groaned. It was the crack of <-<-<-<seven>->->-> and he was allergic to the concept of two seven o’clocks in one day.
"By the time the sun peered over the hills east of Rome, the city was a raucous symphony of clattering carts, hammer blows, and screaming babies. Some in the leisure class allowed themselves the luxury of slumbering on till <-<-<-<seven o’clock>->->->, but only those who had wined to excess would rise any later."
"And we on for a video chat tonight? I mean, in the morning? Your morning? Charlie asked.<br>""Yeah, do you have a time in mind so I can be sure to be up and showered first?""<br>""Sure you can't video chat from the shower?"" he asked.<br>""Not so much. No.""<br>""Then I guess I'll settle for <-<-<-<seven>->->->."""
"It was about <-<-<-<seven o’clock>->->-> and so still I felt that, if someone had spoken a mile away, I could have answered him."
"At <-<-<-<seven>->->-> the next morning the telephone rang.<br>Slowly I swam up from the bottom of a black sleep. I already had a telegram from Jay Cee stuck in my mirror, telling me not to bother to come in to work but to rest for a day and get completely well, and how sorry she was about the bad crabmeat, so I couldn’t imagine who would be calling."
"Anne made her way across the dooryard, trailing a steadying hand along the side of Bobbi’s truck. When she had passed the truck, she reached at once for the porch railing. She looked up, and in the slanting light of <-<-<-<seven o’clock>->->->, Gardener thought the woman looked both aged and ageless."
"Grant immediately understood the advantages. It was now <-<-<-<seven o’clock in the morning>->->->. They had at least eight miles to go. If they could take a raft along the river, they would make much faster progress than going overland."
"Through September and right into October, the North Carolina skies were clear and the air was warm even at <-<-<-<seven in the morning>->->->, when I left my second-floor apartment by the outside stairs. If I started with a light jacket on, I was wearing it tied around my waist before I’d finished half of the three miles between the town and the amusement park."
"The call was early: <-<-<-<seven AM>->->->, two hours before the park opened its doors on another summer. The three of us walked down the beach together. Tom talked most of the way. He always talked. It would have been wearisome if he hadn’t been so amusing and relentlessly cheerful."
"Thirty-seven times my mother and I woke up together, bleary and exhausted at <-<-<-<seven A.M.>->->->, tried to get up, but fell back into bed and slept on while cartoons flashed from the small television on her bedside table."
"In his hotel room at the Bon Voyage, Dr. Rufus Sixsmith reads a sheaf of letters written to him nearly half a century ago by his friend Robert Frobisher. Sixsmith knows them by heart, but their texture, rustle, and his friend’s faded handwriting calm his nerves. These letters are what he would save from a burning building. At <-<-<-<seven o’clock>->->-> precisely, he washes, changes his shirt, and sandwiches the nine read letters in the Gideon’s Bible—this he replaces in the bedside cabinet. Sixsmith slips the unread letters into his jacket pocket for the restaurant."
"This morning everything is clean; the storm has left branches strewn around the yard, which I will presently go out and pick up: all the beach’s sand has been redistributed and laid down fresh in an even blanket pocked with impressions of rain, and the daylilies bend and glisten in the white <-<-<-<seven a.m.>->->-> light."
"By <-<-<-<7:00 A.M.>->->->, the coastline of Malibu was engulfed in flames. Because, just as it is in Malibu’s nature to burn, so was it in one particular person’s nature to set fire and walk away."
"“Which means we finish around <-<-<-<7 a.m.>->->->,” she added. “Still enough time to get to work.”<br>I was surprised. “Work?”<br>“You must work tomorrow, yes?”<br>“I figured I’d write the day off.”<br>“Then you do not need to worry.”"
"<-<-<-<Seven o’clock>->->-> the mess hall opens and the order of line-up reverses: the Wheelers first, then the Walkers, then Acutes pick up trays, corn flakes, bacon and eggs, toast—and this morning a canned peach on a piece of green, torn lettuce."
"“What? No. I mean, yeah, that’s when we have to be in the lot, but there’s a bunch of stuff before, you know, costumes, makeup, all that. I usually get there at <-<-<-<seven>->->->. I can’t believe nobody told you any of this.”"
"It was <-<-<-<seven a.m.>->->-> on the day before her eleventh birthday, and Eva was on her knees in her favorite stretchy blue jeans, hard at work in her closet. She was checking the dryness of her hydroponic chile plants when her mom knocked on her door."
"Why was this woman here? They would have a glass of wine and then Cindy would say that she had a <-<-<-<7:00 a.m.>->->-> yoga class (which was true) and boy, was she tired."
"At <-<-<-<seven o’clock>->->-> precisely, a tiny Italian man entered James’s office. He was wearing a very ancient tuxedo and a white bow tie, which was almost exactly the same size and shape as the mustache on his upper lip."
"Seven o'clock, already, he said to himself when the clock struck again, ""<-<-<-<seven o'clock>->->->, and there's still a fog like this."""
"At <-<-<-<seven o’clock>->->-> in the morning, Rubashov was awakened by a bugle, but he did not get up. Soon he heard sounds in the corridor. He imagined that someone was to be tortured, and he dreaded hearing the first screams of pain. When the footsteps reached his own section, he saw through the eye hole that guards were serving breakfast. Rubashov did not receive any breakfast because he had reported himself ill. He began to pace up and down the cell, six and a half steps to the window, six and a half steps back."
"I had left directions that I was to be called at <-<-<-<seven>->->->; for it was plain that I must see Wemmick before seeing any one else, and equally plain that this was a case in which his Walworth sentiments, only, could be taken. It was a relief to get out of the room where the night had been so miserable, and I needed no second knocking at the door to startle me from my uneasy bed."
"She locked herself in, made no reply to my bonjour through the door; she was up at <-<-<-<seven o'clock>->->->, the samovar was taken in to her from the kitchen."
"I took the first tentative step towards finding out at <-<-<-<one minute past seven>->->-> the next morning, in Fort Bird's mortuary."
"<-<-<-<07:02>->->->:18 One and a half hours. ""Case,"" she said, ""I wanna favour."""
<-<-<-<7:03 a.m.>->->-> Return to bed in sulk over weight. Head-state bad. Sleeping or getting up equally out of question. Think about Daniel.
There was trouble with the track. No one could give any idea when it would be put right. The train arriving at <-<-<-<three minutes past seven>->->-> had been the last one in. Were all the gods of travel conspiring to thwart him?
And hitherto it had decreed that someone should begin to wash and tidy me up at exactly <-<-<-<three minutes after 7 am>->->->.
<-<-<-<7:03 am>->->-> General Tanz woke up as though aroused by a mental alarm-clock.
<-<-<-<7:04 A.M.>->->-><br>Stone felt his consciousness returning as the blast of an engine cut through his sedative‑induced reverie. Where was he? There were vibrations all around him and a deafening roar that was slowly spiraling upward in frequency and volume.
"He really couldn't believe that the old woman who'd phoned him last night would show up this morning, as she'd said she would. He decided he'd wait until <-<-<-<five minutes after seven o'clock>->->->, and then he'd call in, take the day off, and make every effort in the book to locate someone reliable."
"Outside my window the sky hung low and gray. It looked like snow, which added to my malaise. The clock read <-<-<-<five after seven>->->->. I punched the remote control and watched the morning news as I lay in bed."
"Ryan missed the dawn. He boarded a TWA 747 that left Dulles on time, at <-<-<-<7:05 A.M.>->->-> The sky was overcast, and when the aircraft burst through the cloud layer into sunlight, Ryan did something he had never done before. For the first time in his life, Jack Ryan fell asleep on an airplane."
"Percy subscribed to that old axiom about how you should get right back on the horse that had thrown you, because here he came through the door at <-<-<-<six minutes past seven>->->->, resplendent in his blue uniform with his sidearm on one hip and his hickory stick in its ridiculous custom-made holster on the other."
"Qantas Flight 102 touched down at Melbourne Airport at <-<-<-<seven minutes past seven>->->->. Charlie was the first off the aircraft, running as fast as he could, but having to lug Cathy’s picture under one arm slowed him down and made it possible for several other passengers, who obviously had the same idea, to overtake him."
"When Joubert walked into the parade room at <-<-<-<seven minutes past seven>->->-> on the first of January, forty detectives were already seated on the blue-gray government-issue chairs placed in a large rectangle against the four walls."
"<-<-<-<7:08 A.M.>->->-><br>""Team Two CQ,"" came Hans' voice on the walkie-talkie. He and Marcel were in the overhead ventilation duct above Command, which had been depicted in great detail in the blueprints."
Reacher had no watch but he figured when he saw Gregory it must have been <-<-<-<between eight and nine minutes after seven o'clock>->->->.
"We wake up and the air is shiverier. Watch says <-<-<-<07:09>->->->, he has a battery, that’s his own little power hidden inside."
"The morning house lay empty. The clock ticked on, repeating and repeating its sounds into the emptiness. Seven-nine, breakfast time, <-<-<-<seven-nine>->->->!"
"“Get me the head of the Secret Service at the White House.”<br>“Yes, sir.”<br>The Director glanced at his watch: <-<-<-<7:10>->->->. Andrews was due at 8:15. The phone rang."
"When he woke, he jumped out of bed and pulled back the curtains to see the first rays of sunlight bathing the city. He checked the time. It was <-<-<-<7:10 a.m.>->->-> He felt grubby, and smiled at the thought of a long, hot bath."
"A search in Bradshaw informed me that a train left St. Pancras at <-<-<-<7.10>->->->, which would land me at any Galloway station in the late afternoon."
"There were many others waiting to execute the same operation, so she would have to move fast, elbow her way to the front so that she emerged first. The time was <-<-<-<7:10>->->-> in the morning. The manoeuvre would start at 7:12. She looked apprehensively at the giant clock at the railway station."
"Anyway, every morning at <-<-<-<eleven minutes past seven>->->-> he'd slam the door and rev the engine like he was starting a grand prix, ruining my beauty sleep, especially if I'd just come off nights."
"<-<-<-<7:11 a.m.>->->-><br>It could have been the sound of a single explosion, even though it had taken place at the two opposite entries to Command. Then, as one, Team One and Team Three were inside, just behind the harmless explosions of flash grenades and charges of CS they had blasted into the room."
"At <-<-<-<twelve minutes past seven>->->->, in the kitchen, Kimberly was becoming anxious. She had been told by Sister Holland that Miss Gradwyn had asked for her early-morning tea tray to be brought up at seven o'clock."
"He taught me that if I had to meet someone for an appointment, I must refuse to follow the ""stupid human habit"" of arbitrarily choosing a time based on fifteen-minute intervals. ""Never meet people at 7:45 or 6:30, Jasper, but pick times like <-<-<-<7:12>->->-> and 8:03!"""
"It was all the more surprising and indeed alarming a little later, said Austerlitz, when I looked out of the corridor window of my carriage just before the train left at <-<-<-<seven-thirteen>->->->, to find it dawning upon me with perfect certainty that I had seen the pattern of glass and steel roof above the platforms before."
"<-<-<-<07:14>->->-> GMT<br>William spotted him the moment he entered the terminal. A dark blue double-breasted blazer, white shirt, and striped tie. The commander probably slept in double-breasted pajamas."
"I jump onto Rocker to look at Watch, he says <-<-<-<07:14>->->->. I can skateboard on Rocker without holding on to her, then I whee back onto Duvet and I’m snowboarding instead."
At <-<-<-<7.14>->->-> Harry knew he was alive. He knew that because the pain could be felt in every nerve fibre.
"The raft drifted steadily north. “There must be a current.” The current was carrying them north, toward the hotel. He looked at his watch and was astonished to see it was <-<-<-<fifteen minutes past seven>->->->. Only fifteen minutes had passed since he had last looked at his watch. It seemed like two hours."
"At <-<-<-<7:15 A.M.>->->->, January 25th, we started flying northwestward under McTighe's pilotage with ten men, seven dogs, a sledge, a fuel and food supply, and other items including the plane's wireless outfit."
"Gough again knocked on Mr. and Mrs. Kent's bedroom door. This time it was opened - Mary Kent had got out of bed and put on her dressing gown, having just checked her husband's watch: it was <-<-<-<7.15>->->->. A confused conversation ensued, in which each woman seemed to assume Saville was with the other."
"It was early in April in the year ’83 that I woke one morning to find Sherlock Holmes standing, fully dressed, by the side of my bed. He was a late riser, as a rule, and as the clock on the mantelpiece showed me that it was only a <-<-<-<quarter-past seven>->->->, I blinked up at him in some surprise, and perhaps just a little resentment, for I was myself regular in my habits."
"The Zombie SmartGuide works much harder to construct these fictional, time-travel tooth-brushing scenarios than it ever did on normal tooth-brushing scenarios when it was alive. It literally does this all day long. Lately it's taken to showing the transition from <-<-<-<07.16>->->-> to 07.17 quite frequently."
"As of <-<-<-<7.17 am>->->-> local time on 30 June 1908, Padzhitnoff had been working for nearly a year as a contract employee of the Okhrana, receiving five hundred rubles a month, a sum which hovered at the exorbitant end of spy-budget outlays for those years."
"<-<-<-<7:18 A.M.>->->-><br>""Ulysses to Sirene. Do you read me?""<br>When his radio crackled, Armont was in the medical facility of the Bates Motel, watching as a plasma IV was attached to Dimitri's arm. He immediately grabbed for it."
"I opened the sunroof and turned up the CD player volume to combat fatigue, and at <-<-<-<7.19 am>->->-> on Saturday, with the caffeine still running all around my brain, Jackson Browne and I pulled into Moree."
"The two policemen arrived at the Hotel Monarche at <-<-<-<twenty past seven>->->-> that Thursday morning. They were tired, discontent, and hungry. Since midnight they had visited forty-three hotels on the west side of the city, on each occasion with no success."
"The Chairman got out of bed at <-<-<-<7:20>->->-> and lit his first cigarette. He couldn’t remember exactly when he had woken. At 6:10 he had phoned Tony, who was already up and waiting for his call."
"At <-<-<-<7:20>->->->, the door swung open and Anne reappeared to carry out her most important function of the day. “Time to take you through to the studio, Harry.”"
And this was my timetable when I lived at home with Father and I thought that Mother was dead from a heart attack (this was the timetable for a Monday and also it is an approximation). <-<-<-<7.20 a.m.>->->-> Wake up
"He who had been a boy very credulous of life was no longer greatly interested in the possible and improbable adventures of each new day. He escaped from reality till the alarm-clock rang, at <-<-<-<seven-twenty>->->->."
"Why it felt important to know the time she didn’t know, other than to try and root herself in the midst of this chaos. <-<-<-<7.21 a.m.>->->-> So many people would have been eating breakfast, getting ready for work or the Passover holiday."
"<-<-<-<7:22 A.M.>->->-><br>""Do you know how to handle this?"" Vance handed Cally the MP5 he was carrying. He had brought it up the hill to try to take out Ramirez, but after the fiasco with the flash grenades, he hadn't fired a shot."
"<-<-<-<7:23 A.M.>->->-><br>The transmit seemed to be working, and he was getting out everything he knew—the location of the Hind, the fake nationality, the attack on the frigate. But was anybody picking it up? The heavy Soviet radio was rapidly drawing down its batteries, but he figured it was now or never."
Sebastian had to borrow his mother’s alarm clock to make sure he was up in time to catch the <-<-<-<7:23>->->-> to Paddington. Emma was waiting for him in the hall and offered to drive him to Temple Meads. It soon became clear why.
"All three morning shows had offered him their highest rated spot, at <-<-<-<7:24 a.m.>->->-> Six minutes didn’t sound like a long time, but in television terms, only ex-presidents and Oscar winners could take it for granted."
"There was a brief murmur of voices; then Stephen Courtney-Brigs followed her into the sitting-room. Glancing at the clock, Dalgliesh saw that the hands stood at <-<-<-<7:24 a.m.>->->-> The working day had almost begun."
"After taking several phone calls during breakfast, she still hadn’t had a chance to consider the arguments for and against Lord Samuels’s proposal before her driver pulled up outside the front door at <-<-<-<7:25 a.m.>->->->"
"At <-<-<-<twenty-five minutes past seven>->->->: Ker Karraje, Engineer Serko and Captain Spade advance to the extermity of the point, where they sweep the north-western horizon with their telescopes."
"He tried one more time at <-<-<-<7:25>->->->, and nothing had changed. It ran and ran, eleven, twelve, thirteen times.<br>He threw his guitar in his dad’s car and drove south toward Prescott. The Built to Spill tape was still in the tape deck, and he just let it keep going; it might as well be the damn soundtrack to everything."
<-<-<-<7.25 a.m.>->->-> Clean teeth and wash face
Chuck was on deck at <-<-<-<twenty-six minutes past seven>->->-> when marines in helmets and backpacks began to swarm down the rope nets hanging over the sides of the ship and jump into the high-sided landing craft.
The pilot welcomed them aboard and warned them there might be a slight delay. Dexter checked his watch: <-<-<-<7:27>->->->. He began drumming his fingers on the armrest that divided him from Scott.
His appointment with the doctor was for 8.45. It was <-<-<-<7.27>->->->.
"As you know, we're on twenty-four hour call and I got here at <-<-<-<seven twenty-eight>->->->. We decided to start the investigation at once. The undertakers will collect the body as soon as you've finished."
"Lamont was waiting for her on platform 11, and they boarded the <-<-<-<7:29>->->-> to Guildford, second class. On arrival they were met by Superintendent Wall, the only man from the Surrey Constabulary who'd been fully briefed on what they had planned for the rest of the day."
"Everybody turns in his chair and watches that butter sneak on down the wall, starting, hanging still, shooting ahead and leaving a shiny trail behind it on the pane. Nobody says a word. They look at the butter, then at the clock, then back at the butter. The clock’s moving now.<br>The butter makes it down to the floor about a half <-<-<-<minute before seven-thirty>->->->, and McMurphy gets back all the money he lost."
"At <-<-<-<7.29>->->-> in the morning of 1 July, the cinematographer finds himself filming silence itself."
"About <-<-<-<half-past seven>->->-> I woke, and opened my window on a fine sunshiny day. The clock had struck eight, and I was just going out to chain up the dogs again, when I heard a sudden whisking of petticoats on the stairs behind me."
"At <-<-<-<seven-thirty>->->->, Chetta Reynolds blew into the examining room where the Stones and their ceaselessly screaming baby daughter had been stashed. The poet rumored to be on the short list for Presidential Medal of Freedom was dressed in straight-leg jeans and a BU sweatshirt with a hole in one elbow."
"At <-<-<-<seven-thirty>->->-> the next morning, after less than three hours of broken, nightmare-haunted sleep, Tess booted up her office computer. But not to write. Writing was the farther thing from her mind."
"<-<-<-<Seven-thirty>->->-> back to the day room. The Big Nurse looks out through her special glass, always polished till you can’t tell it’s there, and nods at what she sees, reaches up and tears a sheet off her calendar one day closer to the goal."
At <-<-<-<half-past seven>->->-> the next morning he rang the bell of 21 Blenheim Avenue.
"Precisely at <-<-<-<half past seven>->->-> the station-master came into the traffic office. He weighed almost sixteen stone, but women always said that he was incredibly light on his feet when he danced."
I told him he'd sold me on that and we folded the maps and put them back into their waterproof pouches. This was at <-<-<-<07:31>->->-> and Ferris got up and stretched his legs and asked for flying instructions.
"<-<-<-<7:31 A.M.>->->-><br>Bill Bates looked through the Sikorsky's wide windscreen and saw them coming. The time had arrived, he realized immediately, to make a move. Now or never."
"At <-<-<-<7:32>->->->, he suffered a fatal stroke."
"He was taken from me, by the inscrutable decree of the Almighty, on the fifth of this month at <-<-<-<thirty-three minutes past seven>->->-> in the morning, and died in peace of an influential attack of the chest - he had been asthmatic of late years, though otherwise in good health, praise God."
"Wednesday <-<-<-<7:33 A.M.>->->-><br>""You're lucky I love this spot,"" Vance said, gazing out over the city. ""Nothing else on the planet could have got me up this early in the morning."""
"<-<-<-<7:34>->->->. Monday morning, Blackeberg. The burglar alarm at the ICA grocery store on Arvid Morne's way is set off."
"He made another entry in his logbook when Summers emerged from the building at <-<-<-<7:34>->->->, and set off in the direction of the local nick as his radio sprang to life. He listened carefully to what Paul had to report, and said he’d deal with it as soon as he was back in the office."
"Florentyna Kane did not wake until <-<-<-<7:35>->->->. She rolled over, trying to recall the dream she had just had, but none of it would come back to her, so she let her mind wander."
"Trying to identify the key facts, Ethan was suddenly aware he was looking at the wall clock; it was <-<-<-<7:35>->->->.<br>“Wait a minute. When did you hear about this?”<br>There was a tiny moment of hesitation. “The first news came in just before five.”"
"I told him that it was me and he said, ""It’s <-<-<-<7.35>->->-> on a Sunday morning. This is terribly inconsiderate of you. I realize you’re besotted with Marigold, but you must try and restrain your passion. Come to lunch. I’ve got something to show you."""
