"The next day, at <-<-<-<nine minutes to twelve>->->-> o'clock noon, the last clock ran down and stopped. It was then placed in the town museum, as a collector's item, or museum piece, with proper ceremonies, addresses, and the like."
"He walked back to Delaney Street at <-<-<-<eight minutes to twelve>->->-> and pretended to browse the bookshop. At twelve o'clock Monty called to his neighbor and, a second or two later, appeared from the back of the shop wearing his denim jacket and went across to the Blind Beggar."
"Every day Patti Goss-Simpson brings four fish sticks to school and her Titan Deep Freeze lunchbox and every day at <-<-<-<11:52 a.m.>->->->, because the cafeteria is being remodeled, Patti puts her terrible fish sticks in the terrible microwave at the back of Mr. Bates' room and presses the terrible beepy buttons and the smell that pours out feels to Seymour like he’s being pressed face-first into a swamp."
"At any rate, we whirled into the station with many more, just as the great clock pointed to <-<-<-<eight minutes to twelve>->->-> o'clock. ""Thank God! We are in time,"" said the young man, ""and thank you, too, my friend, and your good horse."""
"Afterward it was recalled by observing citizens that just before noon - <-<-<-<seven minutes to twelve>->->->, in fact - a small cloud no bigger than the proverbial hand crossed the sun hurriedly as if afraid to tarry."
He swilled off the remains of [his beer] and looked at the clock. It was <-<-<-<six minutes to twelve>->->->.
"“‘Han will have that shield down,’ ” Aech quoted. “‘We’ve got to give him more time!’”<br>I laughed, then used my robot’s right hand to tap the back of its left wrist, indicating the time. “Aech is right. It’s still <-<-<-<six minutes to noon>->->->.”"
"The prisoners would be allowed out of their cells to watch the World Cup match between England and Argentina. At <-<-<-<five minutes to twelve>->->->, the doors were unlocked and the prisoners flooded out of their cells, all heading in one direction."
He was tearing off on his bicycle to one of the jobs about <-<-<-<five minutes to twelve>->->-> to see if he could catch anyone leaving off for dinner before the proper time.
It was <-<-<-<11:55 a.m.>->->-> on April 30.
"What time did you arrive at the site?<br>""It was <-<-<-<11:55>->->->. I remember since I happened to glance at my watch when we got there. We rode our bicycles to the bottom of the hill, as far as we could go, then climbed the rest of the way on foot."""
Aaron checked his watch on the run: <-<-<-<four minutes to twelve>->->->. He prayed that Harry would be late. Harry was never late.
"16th December 1985, <-<-<-<11:56 a.m.>->->-><br>[UNIT 4B, KING'S MILLS. (MUM IS MAKING ME SIT IN THE OFFICE BECAUSE SHE DOESN'T TRUST ME TO BE IN THE HOUSE ON MY OWN.)]<br>""Doctor, doctor, everyone thinks I'm a liar.""<br>""I find that hard to believe."""
"“At <-<-<-<three minutes to twelve>->->->, I will officially welcome our guest of honor. My speech will last for three minutes, and on the first stroke of twelve, Her Majesty will name the Buckingham with the traditional breaking of a magnum of champagne on the hull.”"
"By the time that it only wanted <-<-<-<three minutes to noon>->->->, the droll object in question was perceived to be a very diminutive foreign-looking young man. He descended the hills at a great rate, so that every body soon had a good look at him."
"A few minutes' light <-<-<-<around noon>->->-> is all that you need to discover the error, and re-set the clock – provide that you bother to go up and make the observation."
"I wondered what the time is? said the latter after a pause.<br>""I don't know exactly"", replied Easton, ""but it <-<-<-<can't be far-off twelve>->->->."""
"Danny turned to the business section of The Times to check on his investments while he waited for the innocent Mr. Hall to appear. At <-<-<-<two minutes to twelve>->->->, Mario was standing by his side. “Sir Nicholas, your guest has arrived.”"
"Nguyen shrugged. He pointed at the clock on the dashboard that said <-<-<-<11:58 AM>->->->. ""Maybe they're heading to lunch."" He smiled, as he returned his focus to the road and the vehicles in front of him.<br>Noack mumbled, ""If only."""
"And when you go down the steps, it's always <-<-<-<11.58>->->-> on the morning of September ninth, 1958."
"<-<-<-<Two minutes before the clock struck noon>->->->, the savage baron was on the platform to inspect the preparation for the frightful ceremony of mid-day. The block was laid forth-the hideous minister of vengeance, masked and in black, with the flaming glaive in his hand, was ready. The baron tried the edge of the blade with his finger, and asked the dreadful swordsman if his hand was sure? A nod was the reply of the man of blood."
"Terry looked at the old man anxiously. “You haven’t signed any papers, have you, Mr. Langley?” She looked at her watch. “It’s just <-<-<-<one minute before twelve>->->->. I still have time to take up that option. Here’s your check!”"
"There is a big grandfather clock there, and as the hands drew <-<-<-<near to twelve>->->-> I don't mind confessing I was as nervous as a cat."
"The day after that again, <-<-<-<about noon>->->->, a decurion with his command of ten horsemen approached Nazareth from the south—that is, from the direction of Jerusalem. The place was then a straggling village, perched on a hill-side, and so insignificant that its one street was little more than a path well beaten by the coming and going of flocks and herds."
"Towards <-<-<-<noon>->->-> he rose and began to write a letter to her; but he could not find the right words, and after many times laying his brush aside he determined at last to send her some nice pictures instead."
"And there, almost at its foot, so close that the shadow of the palace tower fell upon it in the <-<-<-<noonday>->->-> sun, was his own house, sandwiched between the walls, with its small courtyard, two low doors, and the little pool of water."
"At <-<-<-<noon>->->-> that day the galley was skimming the sea off Paestum. The wind was yet from the west, filling the sail to the master’s content. The watches had been established. On the foredeck the altar had been set and sprinkled with salt and barley, and before it the tribune had offered solemn prayers to Jove and to Neptune and all the Oceanidae, and, with vows, poured the wine and burned the incense."
"An hour passed, and though Pilate deigned them no answer, the rabbis and crowd remained. <-<-<-<Noon>->->-> came, bringing a shower from the west, but no change in the situation, except that the multitude was larger and much noisier, and the feeling more decidedly angry."
"Exactly at <-<-<-<noon>->->-> the dromedary, of its own will, stopped, and uttered the cry or moan, peculiarly piteous, by which its kind always protest against an overload, and sometimes crave attention and rest. The master thereupon bestirred himself, waking, as it were, from sleep."
"It was about <-<-<-<noon>->->-> today when Jim Pietre called the office on the phone.<br>""Now, look, Pete,"" he started out. ""What kind of gag are you pulling?""<br>I chortled to myself and pulled the dead pan on him.<br>""What do you mean, boy?"" I asked back into the phone. ""Gag? What kind of gag? What are you talking about?""<br>""A coin. A coin."" He was impatient. ""You remember you sent me a coin in the mail?"""
"Guess what! said Klaus as he spooned lentil soup into Gunther's mouth at the <-<-<-<noon>->->-> meal in Gaza. ""I have the honor of being the first man in Gaza to meet the medical examiners. At one o'clock sharp in Hebron."""
"When Sister Anna brought him back to Patmos at <-<-<-<noon>->->->, Gunther shouted to anyone and everyone within earshot, ""I can read! I can read!"""
"You, Willi, my friend, said Pastor Fritz softly, ""you who sit in midnight darkness at <-<-<-<midday>->->->, is this Jesus Christ a horn of salvation, a light in your darkness?"""
"They were now on their way back toward the city that was flooded with <-<-<-<midday>->->-> sunlight. The sunlight was dense across the plain, and the mountains by Stjärnor disappeared in a blueish gray haze."
"Fine dust in my mouth and nose, sifting through my cotton bandana. Grit in the corners of my eyes, in my ears, all through my hair. When we stopped for a <-<-<-<noon>->->-> meal, I felt as if my own flesh might change back into the dust that coated me."
"Jubilee asked, ""Won't you join us for lunch, Christopher?""<br>""I would like that, but I'm afraid I'm on guard duty at the jail come <-<-<-<noon>->->->. I'd best be going."""
"It was <-<-<-<noon>->->-> and the light came in bursts through the choir windows, and even more through those of the facade, creating white cascades that, like mystic streams of divine substance, intersected at various points of the church, engulfing the altar itself."
"At <-<-<-<twelve o'clock>->->-> the bus came, and Torvik stood at the post office to meet it. Pastor Bengtsson alighted. He was a short, stocky man, with alert black eyes and rather thick rustic lips."
At <-<-<-<twelve o'clock>->->-> the bus would be leaving with the morning mail. It was the last opportunity for the day to post the letter. He really ought not wait any longer with the application. But did he really dare take this step before he was sure of God's will? He prayed afresh.
"Holly tries to ignore the headache her mother’s calls — and this call in particular — almost always bring on. She assures her mother that yes, she will be there on Sunday to help, and yes, she will be there by <-<-<-<noon>->->->, so they can eat one more meal as a family."
"Then my doctor sent me to a psychiatrist at this big hospital. I had an appointment for <-<-<-<twelve o’clock>->->->, and I was in an awful state."
"When she woke up it was <-<-<-<noon>->->->, and someone was pounding on the door. Probably it was West, come back because he’d forgotten something. (His underwear was gone from the drawer, his neatly arranged socks, washed by Tony and folded carefully in pairs. He’d taken a suitcase.)"
"A tub was brought in to melt snow for mortar. They heard somebody saying it was <-<-<-<twelve o’clock>->->-> already.<br>“It’s sure to be twelve,” Shukhov announced. “The sun’s over the top already.”<br>“If it is,” the captain retorted, “it’s one o’clock, not twelve.”<br>“How do you make that out?” Shukhov asked in surprise. “The old folk say the sun is highest at dinnertime.”<br>“Maybe it was in their day!” the captain snapped back. “Since then it’s been decreed that the sun is highest at one o’clock.”<br>“Who decreed that?”<br>“The Soviet government.”"
"“Do you you include violin playing in your category of rows?” he asked, anxiously.<br>“It depends on the player,” I answered, “A well-played violin is a treat for the gods - a badly played one --”<br>“Oh, that’s all right, he cried, with a merry laugh. “I think we may consider the thing as settled — that is, if the rooms are agreeable to you.”<br>“When shall we see them?”<br>“Call for me at <-<-<-<noon>->->-> to-morrow, and we’ll go together and settle everything,” he answered.<br>“All right — noon exactly,” said I, shaking his hand."
"Prowling around aimlessly. A beautiful day—so far. The Rue de Buci is alive, crawling. The bars wide open and the curbs lined with bicycles. All the meat and vegetable markets are in full swing. Arms loaded with truck bandaged in newspapers. A fine Catholic Sunday—in the morning, at least.<br><-<-<-<High noon>->->-> and here I am standing on an empty belly at the confluence of all these crooked lanes that reek with the odor of food."
"“What’s the time?” he said to the clock. It dipped its head, sproinged upright again.<br>“It’s <-<-<-<noon>->->->. It’s noon, it’s noon, it’s . . .”<br>“Shut up,” said Jimmy. The clock wilted. It was programmed to respond to harsh tones."
"“Excellent. You are not averse to this trip, Watson?”<br>“By no means.”<br>“Then we shall both come. What are you going to do yourself?”<br>“I have one or two things which I would wish to do now that I am in town. But I shall return by the <-<-<-<twelve o’clock>->->-> train, so as to be there in time for your coming.”"
"I am writing this at <-<-<-<noon>->->->. Ben is downstairs, reading. He thinks I am resting but, even though I am tired, I am not. I don’t have time. I have to write this down before I lose it. I have to write my journal."
"I did Danièle’s math in my head. “If we start at ten, walk for four hours, rest for one, walk for another two, that’s seven hours in total. That will take us to five in the morning. Seven hours back, it won’t be <-<-<-<noon>->->-> until we resurface.”"
"Mercutio: ""'Tis is no less, I tell you, for the bawdy hand of the dial is now upon the prick of <-<-<-<noon>->->->."""
"Before <-<-<-<noon>->->-> Stan takes her to the laundromat in one of the malls - they’ve used that one before, two of the machines are still working - and he watches the car while she does a load and then pays for it on their phone."
"At <-<-<-<noon>->->-> each day every last one of them, from Don Bernardo the priest to the widow Esmerelda, the village prostitute, stopped work and strolled over to the Pertinis’ vine-shaded terrace, where for two hours they ate like royalty and drank wine made from the same grapes which ripened above their heads."
"There's nobody here! I insisted. ""It was yourself, Mrs. Linton: you knew it a while since.""<br>""Myself!"" she gasped, ""and the clock is striking <-<-<-<twelve>->->->!"""
"A cheap little clock on the wall struck <-<-<-<twelve>->->-> hurriedly, and served to begin the conversation."
"He had saved [the republic] and it was now in the present, alive now and everywhere in the present, and the hovering faces brightened and blurred about him, became the sound of a canal in the morning, the look of some roofs in the <-<-<-<noon>->->-> sun, and the fragrance of a certain evening flower. Here he was, home at last. Behind him were the mountains and the Sleeping Woman in the sky, and before him, like smoky flames in the sunset, the whole beautiful beloved city."
"It was precisely <-<-<-<twelve o’clock>->->->; twelve by Big Ben; whose stroke was wafted over the northern part of London; blent with that of other clocks, mixed in a thin ethereal way with the clouds and wisps of smoke, and died up there among the seagulls."
"<-<-<-<Noon>->->-> found him momentarily alone, while the family prepared lunch in the kitchen. The cracks in the ceiling widened into gaps. The locked wheels of his bed sank into new fault lines opening in the oak floor beneath the rug. At any moment the floor was going to give."
"On Friday <-<-<-<noon>->->->, July the twentieth, 1714, the finest bridge in all Peru broke and precipitated five travellers into the gulf below."
Roaring <-<-<-<noon>->->->. In a well-fanned Forty-second Street cellar I met Gatsby for lunch.
The Birds begun at Four o'clock<br>Their period for Dawn<br>A Music numerous as space<br>But neighboring as <-<-<-<Noon>->->->
"Christmas Eve, and <-<-<-<twelve>->->-> of the clock.<br>""Now they are all on their knees,""<br>An elder said as we sat in a flock<br>By the embers in hearthside ease.<br>We pictured the meek mild creatures where<br>They dwelt in their strawy pen,<br>Nor did it occur to one of us there<br>To doubt they were kneeling then.<br>So fair a fancy few would weave<br>In these years! Yet, I feel,<br>If someone said on Christmas Eve,<br>“Come; see the oxen kneel,<br>“In the lonely barton by yonder coomb<br>Our childhood used to know,”<br>I should go with him in the gloom,<br>Hoping it might be so."
"Then came the stroke of <-<-<-<noon>->->->, and all these working and professional people dispersed like a trampled anthill into all the streets and directions. The white bridge was swarming with nimble dots. And when you considered that each dot had a mouth with which it was now planning to eat lunch, you couldn't help bursting into laughter."
"One day, about the hour of <-<-<-<noon>->->->, a little more than a week after my first experiment, I rolled twenty grains of hashish into a pill and swallowed it, saying as I did so, “Here is the final test for the sake of science.”"
“Madam President …” Florentyna had to think quickly to prevent anyone noticing her instinctive response to the words. “It’s <-<-<-<one minute past midday>->->->.”
"At <-<-<-<one minute past twelve>->->->, Percy stood to attention, slowly raised the Union Jack up the flagpole and delivered the exact words required by the Territories Settlement Act of 1762: “I claim this sovereign territory in the name of Her Majesty Queen Elizabeth II, to whom I swear my allegiance.”"
"It was the twelfth of December, the twelfth month. A was twelve. The electric clock/radio by his bedside table said <-<-<-<12:01>->->->."
At <-<-<-<two minutes past twelve>->->-> the door opens and two men come into the lobby. One is tall with black hair combed in a 50’s pompadour. The other is short and bespectacled. Both are wearing suits.
"It had struck <-<-<-<twelve o'clock two minutes and a quarter>->->->. The Baron's footman hastily seized a large goblet, and gasped with terror as he filled it with hot, spiced wine.<br>""Tis past the hour, 'tis past,"" he groaned in anguish, ""and surely I shall now get the red hot poker the Baron hath so often promised me, oh! Woe is me! Would that I had prepared the Baron's lunch before!"""
"It was now <-<-<-<three minutes after midday>->->->. The blinds had been earlier drawn down, seeming to disconnect time as well as shutting out the surly half-light of late morning."
"At <-<-<-<12.03>->->-> the sun has already punched its ticket. Sinking, it stains the cobbles and stucco of the platz in a violin-coloured throb of light that you would have to be a stone not to find poignant."
"When it’s <-<-<-<12:04>->->-> it can be lunch so I cut a can of baked beans open, I’m careful. I wonder would Ma wake up if I cutted my hand and screamed help?"
I wake up the next day seized by panic. I bolt out of bed and stumble into the kitchen where I look at the clock on the microwave: <-<-<-<12:04 P.M.>->->->
"At <-<-<-<four minutes past twelve>->->->, Frank Macintosh and Paulie Logan enter the lobby dressed in their suits. There are handshakes all around. Frank’s pompadour appears to have had an oil change."
"Though by then it was by Tina's own desk clock <-<-<-<12.04 pm>->->-> I was always touched when, out of a morning's worth of repetition, secretaries continued to answer with good mornings for an hour or so into the afternoon, just as people often date things with the previous year well into February; sometimes they caught their mistake and went into a ""This is not my day"" or ""Where is my head?"" escape routine; but in a way they were right, since the true tone of afternoons does not take over in offices until nearly two."
I could not have committed this crime. Pauline Stacy fell from this floor to the ground at <-<-<-<five minutes past twelve>->->->. A hundred people will go into the witness-box and say that I was standing out upon the balcony of my own rooms above from just before the stroke of noon to a quarter-past - the usual period of my public prayers.
"A few minutes' light <-<-<-<around noon>->->-> is all that you need to discover the error, and re-set the clock – provide that you bother to go up and make the observation."
"But I can tell you this: Z-spotting at Rotfield Mall confirmed yesterday at <-<-<-<12:06 p.m.>->->-> Location: In-Between Burger. Subject: Teenage male, light brown hair, blue eyes."
"On a Monday Simon Hirsch was going to break his leg at <-<-<-<seven minutes after 12>->->->, noon, and as soon as Satan told us the day before, Seppi went to betting with me that it would not happen, and soon they got excited and went to betting with me themselves."
"When a clock struck noon in Washington, D.C., the time was <-<-<-<12:08>->->-> in Philadelphia, 12:12 in New York, and 12:24 in Boston."
2069 June 06 GMT <-<-<-<12.09>->->-> Message sequence 2.<br>Starglider to Earth: You are correct in deducing that the 3 Class Five cultures that engaged in religious activities all had two-parent reproduction and the young remained in family groups for a large fraction of their lifetime. How did you arrive at this conclusion?
"The child said that it was <-<-<-<twelve-ten>->->-> and that Gonda was already late. Another child said that maybe the rain had delayed him. Another said, no not the rain, his director was taking a plane from Hollywood."
"I stashed my basket of dirty rags and Turtle Wax by the exit door in the arcade. It was <-<-<-<ten past noon>->->->, but right then food wasn’t what I was hungry for. I walked slowly along the track and into Horror House."
"Madame Dumas arrived at <-<-<-<noon, and ten minutes later>->->-> Trause handed her his ATM card and instructed her to go to the neighborhood Citibank near Sheridan Square and transfer forty thousand dollars from his savings account to his checking account."
"They paid for only one room and kept Einstein with them because they were not going to need privacy for lovemaking. Exhausted, Travis barely managed to kiss Nora before falling into a deep sleep. He dreamed of things with yellow eyes, misshapen heads, and crocodile mouths full of sharks’ teeth. He woke five hours later, at <-<-<-<twelve-ten>->->-> Thursday afternoon."
"She was to leave the reception as soon as she could and return to her room to change clothes. At <-<-<-<12:11>->->-> there'd be another blackout, during which she'd take the outside stairwell to the ground floor and wait at the exit for a Broadmoor's catering van."
"At <-<-<-<12:11>->->-> there was a knock on the door. It was Terry, A could tell. He hadn't known Terry long, but there was something calmer, more patient, that separated Terry's knocks from the rest of the staff. He knocked from genuine politeness, not formality.<br>""Come in,"" A said, although the lock was on the other side. Terry did.<br>""It's your mother,"" he said. ""There's no easy way to say this."" Though he had just used the easiest, because A now knew the rest. A’s face froze, as it tried to catch up, as it tried to register the news. Then it crumpled, and while he considered this fresh blow, the tears came."
Were you on Carlin Street at approximately <-<-<-<12:12>->->-> when Carietta White came out of the First Congregational Church on that street?
"It was the twelfth of December, the twelfth month. A was twelve. The electric clock/radio by his bedside table said 12:01. A was waiting for it to read <-<-<-<12:12>->->->, he hoped there would be some sense of cosmic rightness when it did."
"It’s <-<-<-<12:13>->->->, so it can be lunch. My favorite bit of the prayer is the daily bread. I’m the boss of play, but Ma’s the boss of meals, like she doesn’t let us have cereal for breakfast and lunch and dinner in case we’d get sick and anyway that would use it up too fast."
"She left London on the <-<-<-<twelve-fourteen>->->-> from Paddington, arriving at Bristol (where she had to change) at two-fifty."
I could not have committed this crime. Pauline Stacy fell from this floor to the ground at five minutes past twelve. A hundred people will go into the witness-box and say that I was standing out upon the balcony of my own rooms above from just before the stroke of noon to a <-<-<-<quarter-past>->->-> - the usual period of my public prayers.
"Very well, dear, she said. ""I caught the 10.20 to Eastnor, which isn't a bad train, if you ever want to go down there. I arrived at a <-<-<-<quarter past twelve>->->->, and went straight up to the house--you've never seen the house, of course? It's quite charming--and told the butler that I wanted to see Mr. Ford on business. I had taken the precaution to find out that he was not there. He is at Droitwich."""
"What shall I think of that's liberating and refreshing? I'm in the mood when I open my window at night and look at the stars. Unfortunately it's <-<-<-<12.15>->->-> on a grey dull day, the aeroplanes are active"
"At <-<-<-<12:16>->->-> Miss Glory brought out the food. It took me a week to learn the difference between a salad plate,a bread plate and a dessert plate."
"Kava ordered two glasses of coffee for himself and his beloved and some cake. When the pair left, exactly <-<-<-<seventeen minutes after twelve>->->->, the club began to buzz with excitement."
"In a bus of the S-line, 10 meters long, 3 wide, 6 high, at 3 km. 600m. from its starting point, loaded with 48 people at <-<-<-<12:17 p.m.>->->->, a person of the masculine sex aged 27 years 3 months and 8 days, 1 m. 72 cm tall and weighing 65 kg. and wearing a hat 35 cm. in height round the crown of which was a ribbon 60 cm."
"Monday, April 6<br><-<-<-<12:18 P.M.>->->-><br>""Hey, how did it go?"" Jennifer asked the minute Ally came in the door.<br>She wasn't sure she knew the answer to that. Initially the job looked like a lot of fun, but now she felt the interpersonal dynamics of working in Bartlett's home were already a problem even before she started."
Not believed to have slept in her bed last night. Could not have left island due to blocked bridge. None of family members has any knowledge as to HV's whereabouts. At <-<-<-<12:19 p.m.>->->->: G.M. informed by telephone about the situation.
"It was already <-<-<-<12:20 p.m.>->->->, and he hadn’t heard a word from Fisher, despite giving him clear instructions to call the moment the meeting was over."
