"While they were drinking at the fountain, church clocks began to strike <-<-<-<midnight>->->->. Missis said gladly, “Oh, Pongo, it’s tomorrow! Now we shall be with our puppies today!”"
"At <-<-<-<midnight>->->-> the entrances were thrown wide, and the rabble, surging in, occupied the quarters assigned to them, from which nothing less than an earthquake or an army with spears could have dislodged them. They dozed the night away on the benches, and breakfasted there; and there the close of the exercises found them, patient and sight-hungry as in the beginning."
"“I thought you asleep,” he said, presently.<br>“Sleep is for old people and little children, and I came out to look at my friends, the stars in the south—those now holding the curtains of <-<-<-<midnight>->->-> over the Nile. But confess yourself surprised!”"
"Ren said, ""If you go to the football field at <-<-<-<midnight>->->-> on Halloween and say his name three times, his ghost is supposed to appear."""
"You, Willi, my friend, said Pastor Fritz softly, ""you who sit in <-<-<-<midnight>->->-> darkness at midday, is this Jesus Christ a horn of salvation, a light in your darkness?"""
"You take a black cat---isn't that it?---that does not have even one white hair (you know this), and you bind his four paws, and then you take him at <-<-<-<midnight>->->-> to a crossroads and you cry out in a loud voice:"
"And I was the lion you do not remember who pushed the boat in which you lay, a child near death, so that it came to the shore where a man sat, wakeful at <-<-<-<midnight>->->->, to receive you."
"If Jill had been more used to adventures, she might have doubted the Owl’s word, but this never occurred to her; and in the exciting idea of a <-<-<-<midnight>->->-> escape she forgot her sleepiness."
"“And almost exactly at <-<-<-<midnight>->->->, the Count’s patience was rewarded. For in accordance with the instructions he’d written to Richard, every telephone on the first floor of the Metropol began to ring.”"
“Wins Sibby damn it!” Mr. Hubert said. “Wins Sibby! What the hell else are we setting up till <-<-<-<midnight>->->-> arguing about?”
"<-<-<-<Midnight>->->->, and there was frost on the fields and patches of black ice on a road notorious for its accidents—there were bunches of dead flowers tied to fence posts and telegraph poles, and torn gaps in hedges, like some kind of failed crop."
"The Place St. Sulpice, so quiet and deserted, where toward <-<-<-<midnight>->->-> there came every night the woman with the busted umbrella and the crazy veil. Every night she slept there on a bench under her torn umbrella, the ribs hanging down, her dress turning green, her bony fingers and the odor of decay oozing from her body; and in the morning I’d be sitting there myself, taking a quiet snooze in the sunshine, cursing the god-damned pigeons gathering up the crumbs everywhere."
"The house is empty, but Eugene sings as if he had for audience all the crowned heads of Europe. The garden door is open and the odor of wet leaves sops in and the rain blends with Eugene’s <em>angoisse</em> and <em>tristesse</em>. At <-<-<-<midnight>->->->, after the spectators have saturated the hall with perspiration and foul breaths, I return to sleep on a bench. The exit light, swimming in a halo of tobacco smoke, sheds a faint light on the lower corner of the asbestos curtain; I close my eyes every night on an artificial eye ..."
"Trevor had on an Andy Warhol costume: blond bobbed wig, thick black glasses, tight striped shirt. My first impression of him was that he was free spirited, clever, funny. That proved to be completely inaccurate. We left the party together and walked around for hours, lied to each other about our happy lives, ate pizza at <-<-<-<midnight>->->->, took the Staten Island Ferry back and forth and watched the sun rise."
"J. Came to my bed at <-<-<-<midnight>->->->, and during our athletics, my door was barged. Farcical horror! Thank God J. had locked it on her way in. The doorknob rattled, insistent knocking began. Fear can clear the mind as well as cloud it, and remembering my <em>Don Juan</em>, I hid J. in a nest of coverlets and sheets in my sagging bed and left the curtain half open to show I had nothing to hide."
"It was an animal thing. A wilderness thing. Nothing about her belonged to her previous self in that moment. Above all her voice. This could have been the high shriek of a hawk, the soul-haunting howl of a wolf, the rasping cry of a red fox at <-<-<-<midnight>->->->. It could have been any of them, but not the scream of a sixteen-year-old schoolgirl."
"Oliver Dubois rammed a pickup truck through his front door on a sweaty <-<-<-<midnight>->->-> in July, at the tail end of a massive block party.<br>It wasn’t his truck, and the street was closed to traffic, so the vehicle’s emergence out of darkness and slow rumble up Oak Drive scattered neighbors and guests alike into confused groups on candlelit lawns."
"She looked at the digital display of her watch.<br>00:00:00<br><-<-<-<Midnight>->->->, as the clock had told her.<br>She waited for the next second to arrive, but it didn’t."
"Farewell, sweet playfellow: pray thou for us;<br>And good luck grant thee thy Demetrius!-<br>Keep word, Lysander: we must starve our sight<br>From lovers’ food till morrow deep <-<-<-<midnight>->->->."
"Here before me was a vast sweep of empty space: just the closed door and me, and only the stars sprinkled across the <-<-<-<midnight>->->-> sky to see what I did next. Did those cold, distant lights watch with any vestige of the humans they had once been, those special, chosen, favored ones who had brushed to close to the divine?"
"Had the lure of blood and ecstasy in the <-<-<-<midnight>->->-> woods brought her sailing over the glittering blue waters? I wondered why she was here now, in the vineyard."
"She summoned the police and, when the men came, sympathetic, at <-<-<-<midnight>->->->, she gave testimony. To have given a home to the wolf and succour to the rabid dog."
"One Christmas at <-<-<-<midnight>->->-> on the button, at the old place, the ward door blows open with a crash, in comes a fat man with a beard, eyes ringed red by the cold and his nose just the color of a cherry."
"At <-<-<-<midnight>->->->, the lights in the café’s kitchen could be particularly harsh. Without the comfort of the daylight streaming in through the stained-glass window, everything in the room looked grim and utilitarian."
Sometimes there is no darker place than our own thoughts; the moonless <-<-<-<midnight>->->-> of the mind.
“It starts at <-<-<-<midnight>->->->.”
Dawn seemed to follow <-<-<-<midnight>->->-> with indecent haste.
"“I shall never forget his flying Henry’s kite for him that very windy day last Easter—and ever since his particular kindness last September twelvemonth in writing that note, at <-<-<-<twelve o’clock>->->-> at night, on purpose to assure me that there was no scarlet fever at Cobham, I have been convinced there could not be a more feeling heart nor a better man in existence.—If any body can deserve him, it must be Miss Taylor.”"
"On the night after his ride to Lawrenceville a crowd sallied to New York in quest of adventure, and started back to Princeton about <-<-<-<twelve o’clock>->->-> in two machines. It had been a gay party and different stages of sobriety were represented."
"As <-<-<-<midnight>->->-> was striking bronze blows upon the dusky air, Dorian Gray, dressed commonly, and with a muffler wrapped round his throat, crept quietly out of his house."
"But wait till I tell you, he said. ""We had a <-<-<-<midnight>->->-> lunch too after all the jollification and when we sallied forth it was blue o'clock the morning after the night before."""
"Midnight, you said. What is <-<-<-<midnight>->->-> to the young? And suddenly a festive blaze was flung Across five cedar trunks, snow patches showed, And a patrol car on our bumpy road Came to a crunching stop. Retake, retake!"
"That a man who could hardly see anything more than two feet away from him could be employed as a security guard suggested to me that our job was not to secure anything but to report for work every night, fill the bulky ledger with cryptic remarks like 'Patrolled perimeter <-<-<-<12.00>->->-> pm, No Incident' and go to the office every fortnight for our wages and listen to the talkative Ms Elgassier."
"'Tis the year's <-<-<-<midnight>->->->, and it is the day's, Lucy's, who scarce seven hours herself unmasks; The sun is spent, and now his flasks Send forth light squibs, no constant rays;"
"At <-<-<-<midnight>->->-> his wife and daughter might still be bustling about, preparing holiday delicacies in the kitchen, straightening up the house, or perhaps getting their kimonos ready or arranging flowers. Oki would sit in the living room and listen to the radio. As the bells rang he would look back at the departing year. He always found it a moving experience."
"Bernardo: 'Tis now struck <-<-<-<twelve>->->->; get thee to bed, Francisco."
"But, odder still - Big Ben had once again struck <-<-<-<midnight>->->->. The time outside still corresponded to that registered by the stopped gilt clock, inside. Inside and outside matched exactly, but both were badly wrong. H'm."
"But in the end I understood this language. I understood it, I understood it, all wrong perhaps. That is not what matters. It told me to write the report. Does this mean I am freer now than I was? I do not know. I shall learn. Then I went back into the house and wrote, It is <-<-<-<midnight>->->->. The rain is beating on the windows. It was not midnight. It was not raining."
"Cartridges not allowed after <-<-<-<0000h.>->->->, to encourage sleep."
"Gately can hear the horns and raised voices and u-turn squeals way down below on Wash. That indicates it's around <-<-<-<0000h.>->->->, the switching hour."
"Hamlet: What hour now? Horatio: I think it lacks of <-<-<-<twelve>->->->. Marcellus: No, it is struck."
"He is certain he heard footsteps: they come nearer, and then die away. The ray of light beneath his door is extinguished. It is <-<-<-<midnight>->->->; some one has turned out the gas; the last servant has gone to bed, and he must lie all night in agony with no one to bring him any help."
I am conceived to the chimes of <-<-<-<midnight>->->-> on the clock on the mantelpiece in the room across the hall. The clock once belonged to my great-grandmother (a woman called Alice) and its tired chime counts me into the world.
"I took her hand in mine, and bid her be composed; for a succession of shudders convulsed her frame, and she would keep straining her gaze towards the glass. 'There's nobody here!' I insisted. 'It was YOURSELF, Mrs. Linton: you knew it a while since.' 'Myself!' she gasped, 'and the clock is striking <-<-<-<twelve>->->->! It's true, then! that's dreadful!'"
"I was born in the city of Bombay . . . On the stroke of <-<-<-<midnight>->->->, as a matter of fact. Clock-hands joined palms in respectful greeting as I came. Oh, spell it out, spell it out: at the precise instant of India's arrival at independence, I tumbled forth into the world."
It is <-<-<-<midnight>->->->. The rain is beating on the windows. I am calm. All is sleeping. Nevertheless I get up and go to my desk. I can't sleep.
"Midnight had come upon the crowded city. The palace, the night-cellar, the jail, the madhouse; the chambers of birth and death, of health and sickness; the rigid face of the corpse and the calm sleep of the child - <-<-<-<midnight>->->-> was upon them all."
"Once upon a <-<-<-<midnight>->->-> dreary,<br>while I pondered weak and weary,<br>Over many a quaint and curious volume of forgotten lore,<br>While I nodded, nearly napping, suddenly there came a tapping,<br>As of some one gently rapping, rapping at my chamber door.<br>""Tis some visitor,"" I muttered, ""tapping at my chamber door - Only this, and nothing more."""
"The clock striketh <-<-<-<twelve>->->-> O it strikes, it strikes! Now body, turn to air, Or Lucifer will bear thee quick to hell. O soul, be changed into little water drops, And fall into the ocean, ne'er to be found. My God, my God, look not so fierce on me!"
"The first night, as soon as the corporal had conducted my uncle Toby up stairs, which was about 10 - Mrs. Wadman threw herself into her arm chair, and crossing her left knee with her right, which formed a resting-place for her elbow, she reclin'd her cheek upon the palm of her hand, and leaning forwards, ruminated until <-<-<-<midnight>->->-> upon both sides of the question."
"To begin my life with the beginning of my life, I record that I was born (as I have been informed an believe) on a Friday, at <-<-<-<twelve o'clock>->->-> at night. It was remarked that the clock began to strike, and I began to cry, simultaneously."
We have heard the chimes at <-<-<-<midnight>->->->.
"It was surely <-<-<-<midnight>->->-> by now. A lone bird called, and the individual trees melted together in one forbidding and unfriendly mass. To Savonius they seemed to incarnate this dismal adventure which had been thrust on him against his will. Somewhere in this deep forest lay this demented man he was supposed to try to comfort and calm."
There was the <-<-<-<midnight>->->-> hike with the boys to the end of the promenade and the big argument about the election of a housemaster. What had become of responsibility and service? And brotherly love?
"“Perhaps. But it might be wise to warn them that I felt it was my duty to inform the tax authorities of your presence in Bristol, so don’t be surprised if the police board your yacht at <-<-<-<one minute past midnight>->->-> and seize it.”"
"She was wearing a watch. Not a digital one, in this life. An elegant, slender analogue one, with Roman numerals. It was about <-<-<-<a minute after midnight>->->->.<br>How is this happening?"
"With the appointed execution time of <-<-<-<one minute past midnight>->->-> just seconds away, I knocked on the metal door twice. The lock turned and the door swiftly swung open."
"And on all sides there were the clocks. Conrad noticed them immediately, at every street corner, over every archway, three quarters of the way up the sides of buildings, covering every conceivable angle of approach. Most of them were too high off the ground to be reached by anything less than a fireman's ladder and still retained their hands. All registered the same time: 12:01. Conrad looked at his wristwatch, noted that it was just 2:45.<br>""They were driven by a master dock,"" Stacey told him. ""When that stopped, they all ceased at the same moment. <-<-<-<One minute after midnight>->->->, thirty-seven years ago."""
At <-<-<-<two minutes past twelve>->->-> the door opens and two men come into the lobby. One is tall with black hair combed in a 50’s pompadour. The other is short and bespectacled. Both are wearing suits.
"<-<-<-<Two minutes past midnight>->->->. With me in the lead the fourteen other men of Teams Yellow, White and Red moved out of the clearing and separated for points along the wall where they would cross over into the grounds."
"Early this morning, 1 January 2021, <-<-<-<three minutes after midnight>->->->, the last human to be born on earth was killed in a pub brawl in a suburb of Buenos Aires, aged twenty-five years, two months and twelve days."
"It was just <-<-<-<three minutes past midnight>->->-> when I last saw Archer Harrison alive. I remember, because I said it was two minutes past and he looked at his watch and said it was three minutes past."
"Suddenly I felt a great stillness in the air, then a snapping of tension. I glanced at my watch. <-<-<-<Three minutes after midnight.>->->-> I was breathing normally and my pen moved freely across the page. Whatever stalked me wasn’t quite as clever as I’d feared, I thought, careful not to pause in my work."
"At <-<-<-<four minutes past twelve>->->->, Frank Macintosh and Paulie Logan enter the lobby dressed in their suits. There are handshakes all around. Frank’s pompadour appears to have had an oil change."
"At <-<-<-<four minutes past midnight>->->->, January 22, Admiral Lowry's armada of more than 250 ships reached the transport area off Anzio. The sea was calm, the night was black."
"It was <-<-<-<after twelve o'clock>->->-> when Easton came home. Ruth recognised his footsteps before he reached the house, and her heart seemed to stop beating when she heard the clang of the gate, as it closed after he had passed through."
"E.M. Security, normally so scrupulous with their fucking trucks at <-<-<-<0005h.>->->->, is nowhere around, lending weight to yet another cliché. If you asked Gately what he was feeling right this second he'd have no idea."
"At <-<-<-<six minutes past midnight>->->->, death relieved the sufferer."
"It was <-<-<-<seven minutes after midnight>->->->. The dog was lying on the grass in the middle of the lawn in front of Mrs. Shears's house. Its eyes were closed. It looked as if it was running on its side, the way dogs run when they think they are chasing a cat in a dream."
"Hour of the night! exclaimed the priest; ""it is day, not night, and the hour is <-<-<-<eight past midnight>->->->!"""
"At <-<-<-<12.09 am>->->-> on 18 October, the cavalcade had reached the Karsaz Bridge, still ten kilometres from her destination."
"Munster tells me that it was in the display case when he locked up last night. That was at <-<-<-<ten minutes past midnight>->->->. He unlocked this morning shortly after six but didn't look at the display case, although he thinks that he might have noticed if the arm had gone. But he can't be sure."
"It was at <-<-<-<ten minutes past midnight>->->->. Three police cars, Alsations and a black maria arrive at the farmhouse. The farmer clad only in a jock-strap, refused them entry."
At <-<-<-<ten minutes past midnight>->->-> a call was made to the police by Garry Ashe from his aunt's house to say that he had returned from a walk to discover her body.
"She was to leave the reception as soon as she could and return to her room to change clothes. At <-<-<-<12:11>->->-> there'd be another blackout, during which she'd take the outside stairwell to the ground floor and wait at the exit for a Broadmoor's catering van."
"The first incendiaries to hit St Thomas's Hospital had splattered Riddell House at <-<-<-<eleven minutes past midnight>->->->, from where a few hours earlier the Archbishop of Canterbury had given 'an inspiring address'."
"Clock time is <-<-<-<0 Hours, 12 Minutes>->->->, 0 Seconds. Twenty three minutes later, they have their first sight of Venus. Each lies with his Eye clapp'd to the Snout of an identical two and a half foot Gregorian reflector made by Mr. Short, with Darkening-Nozzles by Mr. Bird."
It was <-<-<-<twelve minutes past midnight>->->-> when mother and daughter saw the first lightning strike. It hit the main barn with such force the ground trembled under their feet.
"It's <-<-<-<thirteen minutes past midnight>->->->. We're on yet another plane, this time from San Diego To Boston via Chicago. All around me people are sleeping."
It was exactly <-<-<-<fourteen minutes past midnight>->->-> when he completed the final call. Among the men he had reached were honourable men. Their voices would be heard by the President.
"At <-<-<-<twelve-fifteen>->->-> he got out of the van. He tucked the pistol under the waistband of his trousers and crossed the silent, deserted street to the Hudston house."
"The party broke up after supper about a <-<-<-<quarter past twelve>->->->. Seeing her visitors off, Olga Mihalovna stood at the door and said:<br>""You really ought to take a shawl! It's turning a little chilly. Please God, you don't catch cold!"""
"At <-<-<-<sixteen minutes past midnight>->->->, Block 4 was hit and the roof set alight."
"So you deduce that I arrived at the fallen tree later than <-<-<-<twelve seventeen a.m.>->->-> It may have been so. As I wasn't concocting an alibi, I didn't check the time every two minutes."
"Kava ordered two glasses of coffee for himself and his beloved and some cake. When the pair left, exactly <-<-<-<seventeen minutes after twelve>->->->, the club began to buzz with excitement."
"Instantaneously the oblong became a square; then that, too, was extinguished. Toynton Grange lay, a faintly discerned shape etched in the darkness on the silent headland. Curious, he looked at his watch. The time was <-<-<-<eighteen minutes past midnight>->->->."
"21st December 1985, <-<-<-<12:18 a.m.>->->-><br>[IN BED]<br>Michael doesn’t believe in Heaven or Hell. He’s got closer to death than most living people and he tells me there was no tunnel of light or dancing angels. I’m a bit disappointed, to be honest."
"I leaped out of bed, ran down the stairs and into the kitchen through that harsh, searing light. The clock on the wall was showing <-<-<-<nineteen minutes past midnight>->->->. I grabbed my black raincoat from the hook by the back door, pulled on my wellington boots, one of which was almost impossible to get my foot into, and rushed outside."
"When the police arrived at <-<-<-<twelve-twenty>->->-> they found Mrs. O'Keefe lying on a single divan in her front sitting-room, practically naked."
"“But by the time he reached the top of the hill the woman’s body had basically been eaten up already by the flies, right?” my friend said.<br>“In a sense,” his girlfriend replied.<br>“In a sense being eaten by the flies makes it a sad story, doesn’t it?” my friend said.<br>“Yes, I guess so,” she said after giving it some thought. “What do you think?” she asked me.<br>“Sounds like a sad story to me,” I replied.<br>It was <-<-<-<twelve twenty>->->-> when my cousin came back."
"Now she was kneading the little ball of hot paste on the convex margin of the bowl and I could smell the opium. There is no smell like it. Beside the bed the alarm-clock showed <-<-<-<twelve-twenty>->->->, but already my tension was over. Pyle had diminished."
"The aircraft took off at <-<-<-<12:21>->->->, and while the rest of the family dozed, Sasha went over the speech he would deliver on arrival at the airport. He also needed to prepare a eulogy for his uncle’s funeral, but that would have to wait until they checked into their hotel."
"<-<-<-<12:21 A.M.>->->-><br>Uh-oh. Vance felt the tracks suddenly shiver. Then with what sounded like a painful grind of metal on metal, the gantry started moving again. They'd decided to override the safety shutoff."
"Nobody had been one of Mycroft Ward's most important operatives and for sixty seconds every day, between <-<-<-<12.21 am>->->-> and 12.22 am., his laptop was permitted to connect directly with the gigantic online database of self that was Mycroft Ward's mind."
"Nobody had been one of Mycroft Ward's most important operatives and for sixty seconds every day, between 12.21 am and <-<-<-<12.22 am>->->->., his laptop was permitted to connect directly with the gigantic online database of self that was Mycroft Ward's mind."
"Oskar weighed the wristwatch in his hand, then gave the rather fine piece with its luminous dial showing <-<-<-<twenty-three minutes past midnight>->->-> to little Pinchcoal. He looked up inquiringly at his chief. Störtebeker nodded his assent. And Oskar said, as he adjusted his drum snugly for the trip home: ""Jesus will lead the way. Follow thou me!"""
"Sanders with Sutton as his gunner began their patrol at <-<-<-<12.24 am>->->->, turning south towards Beachy Head at 10,000 ft."
"After a moment reality reasserted itself, and she realized she hadn't been hallucinating, but dreaming. The clock on the desk read 12:55. They'd begun their ten-minute session at <-<-<-<12:25>->->->, so obviously she had twenty minutes to account for."
"Charlotte remembered that she had heard Gregoire go downstairs again, almost immediately after entering his bedroom, and before the servants had even bolted the house-doors for the night. He had certainly rushed off to join Therese in some coppice, whence they must have hurried away to Vieux-Bourg station which the last train to Paris quitted at <-<-<-<five-and-twenty minutes past midnight>->->->. And it was indeed this which had taken place."
"I mean, look at the time! <-<-<-<Twenty-five past midnight>->->->! It was a triumph, it really was!"
A Mr. Dutta from King's Cross called and told me you were on your way. He said you wanted to see the arrival of yesterday's <-<-<-<12.26 am>->->->. It'll take me a few minutes to cue up the footage. Our regular security bloke isn't here today; he's up before Haringey Magistrates' Court for gross indecency outside the headquarters of the Dagenham Girl Pipers.
Blake came off the bus behind a pudgy woman carrying a sleeping baby in her arms. The bus driver was talking to a flashy little twist He didn’t even turn to look at the woman and her baby. Blake caught her as she stumbled. She turned and smiled wearily at him. Blake nodded to her and looked up at the terminal clock. It was then <-<-<-<twenty-seven minutes past midnight>->->->.
The DRINK CHEER-UP COFFEE wall clock read <-<-<-<12.28>->->->.
"What time is it? asked Teeny-bits.<br>The station agent hauled out his big silver watch, looked at it critically and announced: ""<-<-<-<Twenty-nine minutes past twelve>->->->.”<br>“Past twelve!"" repeated Teeny-bits. ""It can't be."""
"<-<-<-<Half-past twelve o’clock>->->-> came; Turkey began to glow in the face, overturn his inkstand, and become generally obstreperous; Nippers abated down into quietude and courtesy; Ginger Nut munched his noon apple; and Bartleby remained standing at his window in one of his profoundest dead-wall reveries."
"“I love you more than you can possibly know.”<br>“I love you too.” I smile and his lips linger on my cheek. As he walks down the hall, I note the time: <-<-<-<half past midnight>->->->."
