"It was <-<-<-<5.38 p.m.>->->-> when the Prime Minister’s plane finally broke through the clouds and appeared above Heston Aerodrome. As the ground flickered into view, Legat could see the traffic along the Great West Road. Cars were halted for more than a mile in either direction. It had been raining heavily."
"It’s <-<-<-<05:39>->->-> so we can have dinner, it’s quick noodles. While they’re in the hot water, Ma finds hard words to test me from the milk carton like nutritional that means food, and pasteurized that means laser guns zapped away the germs."
"As no one had “any other business” to raise, I closed the meeting at <-<-<-<5:40>->->->, and suggested to Jeremy that he join Rosemary and me for dinner. I wanted to see them together."
"What? I said, ""is it 5:30 yet?""<br>""Er, <-<-<-<5:40>->->->."" Heavens, they'll be starving. But then that's a good thing. Let them."
"It's <-<-<-<five-forty>->->-> now. The party's at six. By about ten past, the eleventh floor should be clearing. Arnold is a very popular partner; no one's going to miss his farewell speech if they can help it. Plus, at Carter Spink parties, the speeches always happen early on, so people can get back to work if they need to. And while everyone's listening I'll slip down to Arnold's office. It should work. It has to work. As I stare at my own bizarre reflection, I feel a grim resolve hardening inside me. He's not going to get away with everyone thinking he's a cheery, harmless old teddy bear. He's not going to get away with it."
"All right, people, let's haul ass. Sunset's at <-<-<-<17:41>->->-> and we've got twenty-three k to go. Staff Segeant Beyn got to his feet and the platoon followed."
"Well, they set sail, and after going ever so many thousand miles, or hundred - I forget which, but it doesn't matter- a great storm arose, a typhoon or simoon, perhaps both; and after slowly gathering up its energies for the space of twenty-nine days, seven hours, and twenty-three minutes, without counting the seconds, it burst upon them at exactly <-<-<-<forty-two minutes past five>->->->, on the sixth day of the week."
"“I always prefer to travel on a British carrier,” Don Pedro told the purser as they were shown to their seats in first class. The Boeing Stratocruiser took off at <-<-<-<5:43 p.m.>->->->, just a few minutes behind schedule."
"It’s <-<-<-<5:43>->->->. Time is racing, racing."
Janice is not waiting for him in the lounge or beside the pool when at last <-<-<-<around 5.45>->->-> they come home from playing the par-5 eighteenth. Instead one of the girls in their green and white uniforms comes over and tells him that his wife wants him to call home.
"“A <-<-<-<quarter to six>->->->,” answered the midwife.<br>“And what if I really am dying?” thought Olga Mihalovna, looking at her husband’s head and the window-panes on which the rain was beating."
"At <-<-<-<a quarter to six>->->->, there was a rapping sound outside my door. I checked out the peephole. Ramirez stood outside, dressed in a big red basketball-type tank top, black shorts, and flip-flops."
"At <-<-<-<fourteen minutes to six>->->-> they walked into the director’s study, where a young lady of Sally’s age offered the guests a choice of dry sherry or orange juice."
"Then I take it the matter is practically concluded, said the clergyman. ""And that you very properly submit to return to your proper home. And now, if I may offer a suggestion, it is that we take tea. Freed of its tannin, nothing, I think, is more refreshing and stimulating.""<br>""There's a train from Lyndhurst at <-<-<-<thirteen minutes to six>->->->,"" said Widgery, unfolding a time table."
Father came home at <-<-<-<5:48 p.m.>->->-> I heard him come through the front door. Then he came into the living room. He was wearing a lime green and sky blue check shirt and there was a double knot on one of his shoes but not on the other.
"<-<-<-<5:49 P.M.>->->->, SUNDAY, JUNE 8TH, 1924 WHEN ODELL ARRIVED back at Camp IV, he was unable to conceal his excitement. He crawled into Norton’s tent and told him what he’d seen."
It was <-<-<-<eleven minutes to six>->->->. After a moment he idly drew the center drawer of the desk out over his lap. For a moment he stared at the gun without recognition. Then he gave a yelp and leaped up. She had put it back!
He glanced up at the clock above the door: <-<-<-<ten to six>->->->. Young Kevin would appear through that door at any moment and ask if he would be kind enough to move on.
"What time is it Jack?<br>""<-<-<-<Ten to six>->->->""<br>""Ten more minutes then."" I shuffle the cards. ""Time for a quick game of rummy?"""
"Esterville had called the truck stop, but no one had seen his wife come in. She hadn't returned home. Cork and McDougal found her red Mustang at <-<-<-<5:50>->->->."
"She read through the first page slowly and made of a couple of emendations, aware that any mistake made hastily on a Friday evening could be regretted in the weeks to come. She glanced at the clock on her desk as she signed the final page of the document. It was just showing <-<-<-<5:51>->->->."
"The sun was red and the shadows were long and dark. It wanted but <-<-<-<nine minutes to six>->->->, and within the hotel the disgraceful National Swill was in full flow, men pouring as much liquor down their throats as possible before the fatal hour of drought arrived."
"It was <-<-<-<eight minutes to six o'clock>->->->. ""I must get him,"" he told the telephone girl for the dozenth time.<br>""Sorry- no one will answer,"" she said wearily."
"That boy will be spoiled, as sure as I go on springs; he's made such a lot of. Have you been regulated?<br>""I should think I have!"" exclaimed I, in indignant recollection of my education.<br>""All right; keep your temper. What time are you?""<br>""<-<-<-<Seven minutes to six>->->->."""
"It was <-<-<-<5:54 p.m.>->->-> when Father came back into the living room. He said, ""What is this?"" but he said it very quietly and I didn't realise that he was angry because he wasn't shouting."
"One, two, three, four, five, six… She wound each clock in turn, three turns each, putting just enough power in the springs to get them ticking in time for Mr Westcott’s inspection. Speaking of which…it was <-<-<-<five minutes to six>->->->. Five minutes before Mr. Westcott would arrive to inspect his clocks. Helena swallowed. She could hear footsteps thundering in the room below and the occasional exclamation from Stanley."
"The wind moaned and sang dismally, catching the ears and lifting the shabby coat-tails of Mr. Mortimer Jenkyn, 'Photographic Artist', as he stood outside and put the shutters up with this own cold hands in despair of further trade. It was <-<-<-<five minutes to six>->->->."
"Now, sir, the hand wants <-<-<-<four minutes to six>->->->. If the hour strike before you call yourself a wanton, gratuitous calumniator, I'll flog you round the room."
"At <-<-<-<three minutes to six>->->->, despite there still being no sign of Sally, the director suggested they should all make their way to the Great Hall."
"At <-<-<-<three minutes to six>->->->, a tall, well-built man of military bearing pushed his way through the revolving doors. His dark navy blazer, gray flannels, short hair and highly polished shoes all suggested a life of discipline."
"Hugo Carmody had done this, with the result that by <-<-<-<three minutes to six>->->-> he was feeling as if he had been marooned among roses since the beginning of summer."
"He would make his way by charm, the charm of voice, of jewel-like language, above all by the intellectual charm of new, moving, luminous ideas. At <-<-<-<three minutes to six>->->-> the doctor closed the book and waited."
"Then I notice the windows: they're shiny dark. <-<-<-<17:58>->->->, insists my watch. It can't be. It's only just gone four. I peer around my tormentor's belly to find Immaculée Constantin, but she's gone."
"At <-<-<-<one minute to six>->->->, the director led the guest of honor onto the stage. He watched the four hundred girls rise and applaud him in what the director would have described as a “ladylike” manner."
"It was <-<-<-<nearly six o'clock>->->-> in the evening, and the absurd bell in the six-foot tin steeple of the church went clank-clank, clank- clank! as old Mattu pulled the rope within."
"When he arrived it was <-<-<-<nearly six o'clock>->->->, and the sun was setting full and warm, and the red light streamed in through the window and gave more colour to the pale cheeks."
"I haven't been to church in over a year.<br>""Finally worried about your soul?""<br>""Please,"" Cork said<br>""Of course we can talk. When?""<br>""Tomorrow. Late afternoon maybe. Say five o'clock?""<br>""Make it <-<-<-<six>->->->,"" the priest suggested. ""My office.""<br>""I'll be there,"" Cork promised."
"Would a minute have mattered? No, probably not, although his young son appeared to have a very accurate internal clock. Possibly even two minutes would be okay. Three minutes, even. You could go to five minutes, perhaps. But that was just it. If you could go for five minutes, then you’d go to ten, then half an hour, a couple of hours…and not see your son all evening. So that was that. <-<-<-<Six o’clock>->->->, prompt. Every day. Read to young Sam. No excuses. He’d promised himself that. No excuses. No excuses at all. Once you had a good excuse, you opened the door to bad excuses."
"“When did you say you were returning to Amsterdam?”<br>“You know exactly when, because I told you: tomorrow morning.”<br>“Can you get back earlier?”<br>“I could. There’s a KLM flight at four forty-five p.m. today that would get me into Amsterdam just before <-<-<-<six>->->->.”"
"Rick pulled into his driveway, his old Explorer coated in a hazy film of white salt. The winter night had rolled in quickly, the town bathed in darkness by <-<-<-<six p.m.>->->-> He asked Bill to grab his papers and a bit of weed."
"As <-<-<-<six o’clock>->->-> approached, Cryer strolled to the open door of the CAD room. Tom Penny, chewing his lip, was gazing hypnotically at the wall clock."
"“It’s only <-<-<-<six o’clock>->->->,” he observed with a yawn, and then, in a moment, he made an even more interesting discovery."
"When is his tea-time? I inquired.<br>""Oh, at <-<-<-<six o’clock>->->->. He keeps early hours in the country. You had better change your frock now: I will go with you and fasten it. Here is a candle."""
"“What about Nicholas?” Meryl asked as she handed the sheet back to me. I glanced down at the list; there was one space left, the last appointment of the day <-<-<-<six p.m.>->->-><br>“I’ll pop him down there. Could someone let him know?”<br>“I will,” Meryl said.<br>I pencilled his name in with a question mark."
"Dan lay awake until <-<-<-<six>->->->. Then he dressed and once more made the trek to the Red Apple. This time he did not hesitate, only instead of extracting two bottles of Bird from the cooler, he took three. What was it they used to say? Go big or go home."
"Sometimes the manager would play the role of a customer and test them with questions. Then came the employees’ meal: waiters in this restaurant were not going to have growling stomachs as they took their customers’ order!<br>The restaurant opened its doors at <-<-<-<six o’clock>->->->, but guests were slow to arrive  because of the downpour, and several reservations were simply canceled."
"But what was my original self? I couldn’t be sure anymore. I couldn’t help feeling that it was another me, another self that strongly resembled my original self. So now what was I to do? I had lost all sense of direction. I shoved my hand into my pocket and fed every piece of change I found there into a pay phone. Eight rings. Nine. And then she answered.<br>“I was sleeping,” she said with a yawn.<br>“At <-<-<-<six o’clock in the evening>->->->?”"
"Ursula invites me into the wardrobe. “You haven’t aged a day, Timbo, and neither has 𝘵𝘩𝘪𝘴 snaky fellow!” Her furry fawn rubs up against my Narnian-sized lamppost and mothballs . . . but then, as ever, I awoke, my swollen appendage as welcome as a swollen appendix, and as useful. <-<-<-<Six o’clock>->->->. The heating systems composed works in the style of John Cage. Chillblains burned my toe knuckles. I thought about Christmases gone, so many more gone than lay ahead."
"At <-<-<-<6:00 p.m.>->->-> I race home from work and attempt to make myself attractive. Home these days is a tiny bit insanely expensive studio apartment on North Dearborn; I am constantly banging parts of myself on inconvenient walls, countertops and furniture."
"“Good-evening, Mr. James Windibank,” said Holmes. “I think that this typewritten letter is from you, in which you made an appointment with me for <-<-<-<six o’clock>->->->?”"
"Those who went farther than Chicago would gather in the old dim Union Station at <-<-<-<six o’clock>->->-> of a December evening, with a few Chicago friends, already caught up into their own holiday gayeties, to bid them a hasty good-by."
"She sounded surprised, and possibly also disappointed. He said, “Listen, I can’t speak for long, so please concentrate on what I’m about to say. I want you to pack a week’s worth of clothes and get the garage to drive you and the children to your parents’ right away.”<br>“But it’s <-<-<-<six o’clock>->->->.”<br>“They’ll still be open.”<br>“Why do we have to go in such a rush? What’s happened?”<br>“Nothing. Nothing yet, anyway. I just want to know you’re somewhere safe.”<br>“It sounds rather panicky. I hate people who panic.”"
"Lucinda Quant breaks the story of the big leak on the <-<-<-<six o’clock>->->-> news. She’s straightforward, she’s believable, and, best of all, she has extensive document trails and video footage. She tells the story about how she came by her treasure trove of dirt, though she doesn’t name names"
"Out along the dim <-<-<-<six o’clock>->->-> street, I saw leafless trees standing, striking the sidewalk there like wooden lightning, concrete split apart where they hit, all in a fenced-in ring. An iron line of pickets stuck out of the ground along the front of a tangleweed yard, and on back was a big frame house with a porch, leaning a rickety shoulder hard into the wind so’s not to be sent tumbling away a couple of blocks like an empty cardboard grocery box."
"At most times of the day—except during <-<-<-<six o’clock>->->-> Mass—Dervla could be found spying out of her bedroom window. Bolstering her hunched torso with large pillows, she stared with beady, rhubarb gray eyes out into the damp street below, determined not to miss a minute of provincial drama."
"“You are remarkable, aren’t you!” Amory was becoming trite from where he perched in the centre of the dining-room table one <-<-<-<six o’clock>->->->."
"“<-<-<-<Six o’clock>->->->,” said Amory, glancing at his wrist-watch. “I’ll buy you a grea’ big dinner on the strength of the Juvenalia of your collected editions.”"
"And ever since that, the Hatter went on in a mournful tone, ""he won’t do a thing I ask! It’s always <-<-<-<six o’clock>->->-> now."""
<-<-<-<6.00 p.m.>->->-> Have tea
"Although it was only <-<-<-<six o'clock>->->->, the night was already dark. The fog, made thicker by its proximity to the Seine, blurred every detail with its ragged veils, punctured at various distances by the reddish glow of lanterns and bars of light escaping from illuminated windows."
"Did you go down to the farm while I was away?<br>""No,"" I said ""but I saw Ted.""<br>""Did he have a message for me?"" she asked. ""He said today was no good as he was going to Norwich. But Friday at <-<-<-<six o'clock>->->->, same as usual.""<br>""Are you sure he said six o'clock?"" she asked, puzzled.<br>""Quite sure."""
"King Richard: What is o'clock?<br>Catesby: It is <-<-<-<six o'clock>->->->, full supper time.<br>King Richard: I will not sup tonight. Give me some ink and paper."
"Leon waited all day for <-<-<-<six o'clock>->->-> to arrive; when he got to the inn, he found no one there but Monsieur Binet, already at the table."
Oh oh oh. <-<-<-<Six o'clock>->->-> and the master not home yet.
The newspaper snaked through the door and there was suddenly a <-<-<-<six o'clock>->->-> feeling in the house
The winter evening settles down With smell of steaks in passageways. <-<-<-<Six o'clock>->->->.
"When the bells of Calvary Church struck <-<-<-<six>->->->, she saw Mr. and Mrs. Biggs hurrying down the front stoop, rushing off to the shops before they closed."
"At <-<-<-<one minute past six>->->->, he turned to Tom and said, “Hi, I’m Nat Cartwright and…”"
"“No one stops, even to draw breath, until <-<-<-<one minute past six>->->-> when the last vote will have been cast."""
"David had followed me at <-<-<-<one minute past six>->->->. Then three others had managed to get away, making it five altogether. But as the sixth Hurricane was gathering speed for lift-off, a swarm of Messerschmitts had come swooping in over the olive trees."
"Incidentally, confirmed by a record of a small and poorly defined shallow-focus earthquake around two hundred and fifty kilometers north of Herrandown at <-<-<-<6:02 p.m.>->->-> But there is a major problem."
Jarrod stared at the clock on his computer. It said <-<-<-<6:03>->->->. Outside his office window it was dark. It felt as if someone had sucked all the oxygen from the room and he took an extra breath before responding.
"Above it all rose the Houses of Parliament, with the hands of the clock stopped at <-<-<-<three minutes past six>->->->. It was difficult to believe that all that meant nothing any more, that now it was just a pretentious confection that could decay in peace."
"We will make record of it, my Rosannah; every year, as this dear hour chimes from the clock, we will celebrate it with thanksgivings, all the years of our life.<br>""We will, we will, Alonzo!""<br>""<-<-<-<Four minutes after six>->->->, in the evening, my Rosannah..."""
<-<-<-<6:05 p.m.>->->-> Wonder where everybody is? I suppose they are all out with their boyfriends or have gone home to their families.
At about <-<-<-<five past six>->->-> Piers came in carrying an evening paper and a few books.
"At <-<-<-<6:06>->->->, every toilet on Merit Street suddenly exploded in a geyser of shit and raw sewage as some unimaginable reversal took place in the pipes which fed the holding tanks of the new waste-treatment plant in the Barrens."
"According to the Book of Revelation, the great beast's number is 666. So that exact time would be <-<-<-<six minutes past six>->->-> on the sixth of the sixth, sixty-six. Double whammy."
"The minutes ticked by. The silence in the room roared in their ears. At <-<-<-<seven minutes past six>->->->, Charles's phone rang."
"<-<-<-<6:08 p.m.>->->-> The code-word ""Valkyrie"" reached von Seydlitz Gabler's headquarters"
"Here I am, at <-<-<-<nine minutes past six>->->-> on a drizzly Saturday evening, with every intention of writing a book in one sitting."
‘I’d like to see your passenger list for yesterday afternoon’s <-<-<-<6.10>->->-> flight for Brussels.’
"Let me see now. You had a drink at the Continental at <-<-<-<six ten>->->->.<br>""Yes.""<br>""And at six forty-five you were talking to another journalist at the door of the Majestic?""<br>""Yes, Wilkins. I told you all this, Vigot, before. That night."""
"The first explosion occurred at <-<-<-<eleven minutes past six>->->->. The chart-house and part of the bridge were blown to pieces. Three dull, splintering crashes ensued in rapid succession, proving beyond question that the bombs were set to automatically explode at a given time."
"Bill Russell left the office at <-<-<-<6:12>->->-> that evening, and never entered the building again."
"He checked his watch: <-<-<-<6:12 p.m.>->->-> He left the dining room and went downstairs to the wine cellar. A single bulb lit a room that had once stored filing cabinets full of archives. Since Giles’s arrival, they had been replaced by wine racks."
"Wednesday <-<-<-<6:12 P.M.>->->-><br>The dusk was settling majestically over Tokyo, after a rare smogless day. The view was particularly inspiring from the fifty-fifth-floor penthouse of the granite-clad Mino Industries building."
"At <-<-<-<06:12>->->-> Noreen brings another whole tray that’s dinner, we can have dinner at five something or six something or even seven something, Ma says."
"It’s <-<-<-<06:13>->->->, that’s getting nearly to be the evening. Ma says I really should be wrapped up in Rug already, Old Nick might possibly come in early because of me being sick."
"Is he conscious? Has the ether—<br>""I can't say as to that,"" said Simmy cheerfully. ""He's been back in his room since five o'clock. That's—let's see what time is it now? <-<-<-<Six-fourteen>->->->. Nearly an hour and a quarter. They all say—"""
"<-<-<-<Quarter past six>->->->, said Tony. ""He's bound to have told her by now."""
At a <-<-<-<quarter past six>->->-> he was through with them.
I checked the time on the corner of my screen. <-<-<-<6.15 pm.>->->-> I was never going to finish my essay in forty-five minutes
"The clock above the door said <-<-<-<sixteen minutes past six>->->->. The pictures showed the door opening and a rug coming in - just the rug, flat, held up perpendicular, hanging straight down. Of course there was someone behind it."
The printed front of the card read Bernis Sand. On the back was written in pencil: your westbound tram stop at <-<-<-<18:17>->->->. There was no date or signature. At 18:17 Adele stepped out of the townhouse with Trovera at her side.
"He glanced at his watch, <-<-<-<6.18 p.m.>->->->, and moved into first gear. He climbed off the bed, stripped off his clothes and threw them over a chair before going into the bathroom and taking a long shower."
It was at <-<-<-<18:18>->->-> when a sixty-one-year-old Tibetan woman telephoned for a fire engine to put out a burning car.
Gravesend's a black cloud. Vinny and Stella and Mam are in it. Are it. My watch says <-<-<-<18:19>->->-> and the Captain Marlow'll be cheerful and chattery as the evening regulars drift in.
"In Harley Street, Bond Street, the King’s Road and Magdalen College, Oxford, it was <-<-<-<6:20 P.M.>->->-> Four men, unknown to each other, checked the market price of Prospecta Oil in the final edition of the London Evening Standard."
It was <-<-<-<six twenty>->->-> before Sarah Berowne managed to reach Ivor Garrod by telephone. She had been in her flat most of the early part of the afternoon but hadn't dared ring from there.
"By the time Elliot's mother arrived at <-<-<-<twenty past six>->->->, Mrs. Sen always made sure all evidence of her chopping was disposed of."
"5.20 pm - <-<-<-<6.21 pm>->->->: Miss Pettigrew found herself wafted into the passage. She was past remonstrance now, past bewilderment, surprise, expostulation. Her eyes shone. Her face glowed. Her spirits soared. Everything was happening too quickly. She couldn't keep up with things, but, by golly, she could enjoy them."
"<-<-<-<18:22 GMT>->->-><br>""The firearms squad is in place, sir,"" said a lone voice over the intercom, sounding like a crack of thunder, after a couple of hours of silence."
"It was <-<-<-<six twenty-two>->->->, Commander. I happened to glance at the clock.<br>He held open the door wide. It seemed less an invitation to leave than a command."
Clock overturned when he fell forward. That'll give us the time of the crime. <-<-<-<Twenty-two minutes past six>->->->.
"A picnic lunch in the kitchen, a double bolt drawn across the front door just in case the impossible happened and Father came home from the bank before <-<-<-<twenty-three minutes past six>->->-> in the evening."
"We were cleared by the tower at <-<-<-<18:24>->->-> and got airborne seven minutes after the scheduled departure time. The evening sky was almost clear, with a scattering of cumulous along the southern horizon and the windsocks hanging limp."
"Without preamble, Dalgliesh said, ""Mrs. Tallulah Clutton, the housekeeper at the Dupayne Museum, has this afternoon recognized you as the motorist who knocked her off her bicycle at about <-<-<-<six twenty-five>->->-> on Friday the first of November. On that night two people were murdered at the museum, Dr. Neville Dupayne and Miss Celia Mellock."""
At <-<-<-<6:25>->->-> Claudia locked away the files she had been working on and went upstairs to wash and fetch her coat. The house was ablaze with light. Since Gerard's death she had hated working alone in the darkness.
"At <-<-<-<twenty-five past six>->->-> I go into the bathroom and have a wash, then while the Old Lady's busy in the kitchen helping Chris with the washing up I get my coat and nip out down the stairs."
"I have this moment, while writing, had a wire from Jonathan saying that he leaves by the <-<-<-<6.25>->->-> tonight from Launceston and will be here at 10.18, so that I shall have no fear tonight."
"I checked the time on my mobile phone - <-<-<-<18:26 p.m.>->->-><br>""Do you want to grab a pizza?"" Cara asked as she walked in twenty minutes later. I looked up at her. She shook her head smiling, questioning."
"It is <-<-<-<around half past six>->->-> in the evening. Dusk is gathering in the living room, an early dusk due to the fog which has rolled in from the Sound and is like a white curtain drawn down outside the windows."
It was <-<-<-<6:27>->->->. In Frances Peverell's flat the phone rang. As soon as James spoke her name she knew that something was wrong.
"At <-<-<-<6:28 p.m.>->->->, a ""Breaking News Alert"" from the Examiner flashed to mobile phones and computers throughout the Chicago area: ""Thomas R. O'Sullivan III, youngest member of once-powerful Illinois political family, among two slain in Diamond Point holdup. Lone gunman sought."""
